Timeline Order,Event Label,Milestone ID,Run Family,Phase,Train Split,Eval Split,Warm Start,Status,Best Exact,Best Composite,Key Change,Interpretation
0,Baseline,baseline_local_snapshot,baseline_pre_refactor,baseline,unknown_pre_refactor,unknown_pre_refactor,,reference,0.375,0.4054687500000001,Pre-refactor RL baseline without staged curriculum or metric-aware checkpointing.,"Pre-refactor baseline: structure was unreliable, truncation was common, and completions were long."
1,Smoke Phase A,smoke_phase_a_best,smoke_testmini,phase_a,testmini,testmini,,validated,0.5,0.39999999999999997,Structure stabilization on Stage 1 easy numeric subset.,Phase A began structure stabilization but still had 50% malformed and truncated outputs on the tiny smoke eval.
2,Smoke Phase B,smoke_phase_b_best,smoke_testmini,phase_b,testmini,testmini,best_structure,stabilized_structure,0.5,0.6,Correctness strengthening on Stage 1+2 mix after structure stabilization.,"Phase B achieved perfect structure on the smoke eval, but correctness plateaued at 0.5."
3,Smoke Phase C,smoke_phase_c_best,smoke_testmini,phase_c,testmini,testmini,best_composite,ready_for_scale_up,0.5,0.6,Precision and harder numeric reasoning on Stage 2+3 with larger split continuation.,Smoke Phase C preserved perfect structure but still sat at the 0.5 correctness plateau that the larger split later broke.
4,Smoke Phase D,smoke_phase_d_best,smoke_testmini,phase_d,testmini,testmini,best_composite,small_split_limit_reached,0.5,0.39999999999999997,Hard numeric specialization on Stage 3-heavy subset.,Smoke Phase D did not improve over Smoke Phase C; structure regressed back to 0.25 despite unchanged 0.5 exact match.
5,Large Phase C,large_phase_c_best_recommended,large_split_continue,phase_c,test,testmini,/kaggle/input/datasets/mcgmcg1/rl-gspo-qwen2-5vlm-phasec-best-checkpoint/phase_c_best/checkpoint-119,improved_correctness,0.75,0.75,Precision and harder numeric reasoning on Stage 2+3 with larger split continuation.,Larger-split Phase C is the primary deployable checkpoint: structure stayed perfect and exact/tolerance improved to 0.75.
6,Large Phase D,large_phase_d_same_notebook_best,large_split_continue,phase_d,test,testmini,best_composite,matched_then_regressed,0.75,0.75,Hard numeric specialization on Stage 3-heavy subset.,"Phase D in the same notebook recovered to 0.75 early, but the run later regressed."
7,Dedicated Phase D,dedicated_phase_d_best,phase_d_dedicated,phase_d,test,testmini,/kaggle/input/datasets/mcgmcg1/rl-gspo-qwen2-5vlm-large-phasec-best-checkpoint/phase_c_large_best/checkpoint-120,matched_specialization,0.75,0.75,Hard numeric specialization on Stage 3-heavy subset. Dedicated notebook preserved earlier large-split outputs.,"Dedicated Phase D recovered to 0.75 exact/tolerance, matching but not exceeding the larger-split Phase C best."
